cmr_concept_type,cmr_concept_id,cmr_native_id,cmr_provider_id,cmr_revision_id,cmr_revision_date,cmr_publication_date,coll_title,coll_version,coll_doi,coll_abstract,coll_shortname,coll_status,coll_proclvl,coll_proclvl_desc,time_min,time_max,lat_min,lat_max,lon_min,lon_max,geometry
collection,C1000000070-ORNL_DAAC,"NACP MCI: Tower Atmospheric CO2 Concentrations, Upper Midwest Region, USA, 2007-2009",ORNL_DAAC,19,2019-04-15T18:40:01Z,,"NACP MCI: Tower Atmospheric CO2 Concentrations, Upper Midwest Region, USA, 2007-2009",1,10.3334/ORNLDAAC/1202,"This data set provides high precision and high accuracy atmospheric CO2 data from seven instrumented communication towers located in the U.S. Upper Midwest. The overall sampling period was from January 2007 through December 2009 although actual sampling dates vary within this time period for individual towers and sampling heights above ground level. The measurements were obtained in support of the North American Carbon Program (NACP) Mid-Continent Intensive (MCI) campaign.The sampling network included: the five Ring 2 towers (Centerville (Iowa), Galesville (Wisconsin), Kewanee (Illinois), Mead (Nebraska), and Round Lake (Minnesota)) deployed and operated by PSU; the Missouri Ozarks (Missouri) co-located AmeriFlux site (PSU/Oak Ridge National Laboratory (ORNL)); and the Rosemount (Minnesota) tall tower trace gas observatory (University of Minnesota, Rosemount Research and Outreach Center (RROC)). Hourly CO2 dry mole fractions (in ppm) were averaged from measurements made at different above-ground levels on the towers and are reported in Coordinated Universal Time (UTC). For the five Ring 2 sites, daily daytime average CO2 dry mole fractions were also calculated, from hourly values between 12:00-17:00 local standard time and reported in UTC. There are seven compressed (.zip) data files and one comma-separated (.csv) file with this data set. Data quality flags are provided in each file. ",NACP_MCI_CO2_MEASUREMENTS_1202,COMPLETE,3,Variables mapped on uniform space-time grid scales with completeness and consistency,,,38.74,44.69,-96.46,-89.97,"POLYGON ((-89.97 38.74, -89.97 44.69, -96.45999999999999 44.69, -96.45999999999999 38.74, -89.97 38.74))"
collection,C179130745-ORNL_DAAC,NACP MsTMIP Summary of Model Structure and Characteristics,ORNL_DAAC,31,2019-04-15T18:40:12Z,,NACP MsTMIP Summary of Model Structure and Characteristics,1,10.3334/ORNLDAAC/1228,"This data set provides a summary of the model structure and characteristics of participating models in the North American Carbon Program (NACP) Multi-scale synthesis and Terrestrial Model Intercomparison Project (MsTMIP), a formal model intercomparison and evaluation effort focused on improving the diagnosis and attribution of carbon exchange at regional and global scales. Model structure refers to the types of processes considered (e.g. nutrient cycling, disturbance, lateral transport of carbon), and the specific ways these processes are represented (e.g. photosynthetic formulation, temperature sensitivity, respiration) in the models. These data are the result of a comprehensive survey of investigators responsible for each MsTMIP participating model. For a given characteristic (i.e., process/attribute), a model was assigned a binary value (0 or 1) indicating whether it included a particular characteristic; a value of one (1) was given if it considered or included that process, or a zero (0) if it did not. MsTMIP builds upon current and past synthesis activities, and has a unique framework designed to isolate, interpret, and inform understanding of how model structural differences impact estimates of carbon uptake and release. There is one data file with this data set in .csv format.",NACP_MSTMIP_MODEL_STRUCTURE_1228,COMPLETE,4,model products,,,-90.0,90.0,-180.0,180.0,"POLYGON ((180 -90, 180 90, -180 90, -180 -90, 180 -90))"
collection,C1515244932-ORNL_DAAC,"NACP MsTMIP: Global 0.5-degree Model Outputs in Standard Format, Version 1.0",ORNL_DAAC,15,2019-04-15T18:40:11Z,,"NACP MsTMIP: Global 0.5-degree Model Outputs in Standard Format, Version 1.0",1,10.3334/ORNLDAAC/1225,"This data set provides global gridded estimates of carbon, energy, and hydrologic fluxes between the land and atmosphere from 15 Terrestrial Biosphere Models (TBMs) in a standard format. Model estimates are at monthly and yearly time steps for the period 1900 to 2010, with a spatial resolution of 0.5 degree x 0.5 degree globally, excluding Antarctica.",NACP_MsTMIP_TBMO_1225,COMPLETE,4,model products,,,-90.0,90.0,-180.0,180.0,"POLYGON ((180 -90, 180 90, -180 90, -180 -90, 180 -90))"
collection,C179126646-ORNL_DAAC,NACP MsTMIP: Global and North American Driver Data for Multi-Model Intercomparison,ORNL_DAAC,35,2019-04-15T18:40:09Z,,NACP MsTMIP: Global and North American Driver Data for Multi-Model Intercomparison,1,10.3334/ORNLDAAC/1220,"This data set provides environmental data that have been standardized and aggregated for use as input to carbon cycle models at global (0.5-degree resolution) and regional (North America at 0.25-degree resolution) scales. The data were compiled from selected sources (Table 2) and integrated into gridded global and regional collections of climatology variables (precipitation, air temperature, air specific humidity, air relative humidity (NA only), pressure, downward longwave radiation, downward shortwave radiation, and wind speed), time-varying atmospheric CO2 concentrations, time-varying nitrogen deposition, biome fraction and type, land-use and land-cover change, C3/C4 grasses fractions, major crop distribution, phenology, multiple soil characteristics, and a land-water mask. The temporal ranges of the data are sufficient for carbon cycle model simulations from 1801 to 2010. These data were compiled specifically for the North American Carbon Program (NACP) Multi-Scale Synthesis and Terrestrial Model Intercomparison Project (MsTMIP) as the prescribed model input driver data (Huntzinger et al., 2013). The driver data were used by 22 terrestrial biosphere models to run baseline and sensitivity simulations. The standardized data provided consistent model inputs to minimize the inter-model variability caused by differences in environmental drivers and initial conditions. Together with the sensitivity simulations, the standardized input data enable better interpretation and quantification of structural and parameter uncertainties of model estimates. Data are provided in Climate and Forecast (CF) metadata convention compliant (version 1.4) netCDF-4 file formats. There are 3,152 *.nc4 data files with this data set. ",NACP_MSTMIP_MODEL_DRIVER_1220,COMPLETE,4,model products,,,-78.25,89.75,-178.75,179.95,"POLYGON ((179.95 -78.25, 179.95 89.75, -178.75 89.75, -178.75 -78.25, 179.95 -78.25))"
collection,C179131346-ORNL_DAAC,NACP MsTMIP: Unified North American Soil Map,ORNL_DAAC,34,2019-04-15T18:40:13Z,,NACP MsTMIP: Unified North American Soil Map,1,10.3334/ORNLDAAC/1242,"This data set provides soil maps for the United States (US) (including Alaska), Canada, Mexico, and a part of Guatemala. The map information content includes maximum soil depth and eight soil attributes including sand, silt, and clay content, gravel content, organic carbon content, pH, cation exchange capacity, and bulk density for the topsoil layer (0-30 cm) and the subsoil layer (30-100 cm). The spatial resolution is 0.25 degree. The Unified North American Soil Map (UNASM) combined information from the state-of-the-art US General Soil Map (STATSGO2) and Soil Landscape of Canada (SLCs) databases. The area not covered by these data sets was filled by using the Harmonized World Soil Database version 1.21 (HWSD1.21). The Northern Circumpolar Soil Carbon (NCSCD) database was used to provide more accurate and up-to-date soil organic carbon information for the high-latitude permafrost region and was combined with soil organic carbon content derived from the UNASM (Liu et al., 2013). The UNASM data were utilized in the North American Carbon Program (NACP) Multi-Scale Synthesis and Terrestrial Model Intercomparison Project (MsTMIP) as model input driver data (Huntzinger et al., 2013). The driver data were used by 22 terrestrial biosphere models to run baseline and sensitivity simulations. The compilation of these data was facilitated by the NACP Modeling and Synthesis Thematic Data Center (MAST-DC). MAST-DC was a component of the NACP (www.nacarbon.org) designed to support NACP by providing data products and data management services needed for modeling and synthesis activities.",NACP_MSTMIP_UNIFIED_NA_SOIL_MA_1242,COMPLETE,4,model products,,,10.0,84.0,-170.0,-50.0,"POLYGON ((-50 10, -50 84, -170 84, -170 10, -50 10))"
collection,C1000000620-ORNL_DAAC,"NACP NAFD Project: Forest Disturbance History from Landsat, 1986-2010",ORNL_DAAC,24,2019-04-15T18:54:08Z,,"NACP NAFD Project: Forest Disturbance History from Landsat, 1986-2010",1,10.3334/ORNLDAAC/1290,"The North American Forest Dynamics (NAFD) products provided in this data set consist of 25 annual and two time-integrated forest disturbance maps for the conterminous United States (CONUS) derived from Landsat images for the period 1986-2010. Each annual map has classified pixels showing water, no forest cover, forest cover, no data available (data gaps) in present year, and forest disturbances that occurred in that year. The time-integrated maps are similarly classified, but over the entire 1986-2010 period with the first and last forest disturbance years identified and provided as separate maps.",NAFD-NEX_Forest_Disturbance_1290,COMPLETE,3,Variables mapped on uniform space-time grid scales with completeness and consistency,,,22.69,51.68,-128.03,-65.2,"POLYGON ((-65.2 22.69, -65.2 51.68, -128.03 51.68, -128.03 22.69, -65.2 22.69))"
collection,C179003651-ORNL_DAAC,NACP New England and Sierra National Forests Biophysical Measurements: 2008-2010,ORNL_DAAC,33,2019-04-15T18:39:46Z,,NACP New England and Sierra National Forests Biophysical Measurements: 2008-2010,1,10.3334/ORNLDAAC/1046,"This data set includes biophysical measurements collected in 2009 from five New England experimental forest stations: Bartlett Experimental Forest, Harvard Forest, Howland Research Forest, Hubbard Brook Experimental Forest, and the Penobscot Experimental Forest. Howland measurements were repeated in 2010 and one site in the Sierra National Forest, California, was surveyed in 2008. Biomass in respective measurement plots was calculated with allometric equations using measured diameter at breast height (DBH) for trees greater than 10 cm and species identification. Within selected subplots, the number of stems with diameters less than 10 cm were counted and classified to allow for an estimate of biomass for these stems.  There are 16 data files provided that present the biophysical measurement results and the biomass estimates in ASCII comma-separated format.  For a subset of sites and plots (Bartlett Experimental Forest, Harvard Forest and Howland Research Forest), more intensive inventories were done in coordination with Echidna lidar imaging (Strahler et al., 2008). In these intensive collections, the stem location, species, DBH and live/dead status were recorded for all stems with total stem height and canopy dimensions recorded for every tenth stem. In addition, for stems below 10 cm DBH, species and count were recorded in a subplot of each intensive inventory plot. See the related data set Strahler et al., 2011.Investigators from Federal and university laboratories conducted these field campaign to make estimates of forest biophysical attributes that will prove useful in comparisons with airborne lidar (LVIS) and UAVSAR remote sensing acquisitions. The North American Carbon Program (NACP) is a multi-disciplinary research program designed to obtain scientific understanding of North America's carbon sources and sinks and of the changes in carbon stocks needed to meet societal concerns, and to provide tools for decision makers. NACP began in 2002 and continues to date. The NACP data collection contains continental carbon budgets, dynamics, processes, and management of the sources and sinks of carbon dioxide, methane, and carbon monoxide in North America and in adjacent ocean regions. ",NACP_FOREST_BIOPHYSICAL_1046,COMPLETE,3,Variables mapped on uniform space-time grid scales with completeness and consistency,,,36.96,45.21,-119.25,-68.58,"POLYGON ((-68.58 36.96, -68.58 45.21, -119.25 45.21, -119.25 36.96, -68.58 36.96))"
collection,C179126405-ORNL_DAAC,"NACP North American 8-km Net Ecosystem Exchange and Component Fluxes, 2004",ORNL_DAAC,35,2019-04-15T18:40:02Z,,"NACP North American 8-km Net Ecosystem Exchange and Component Fluxes, 2004",1,10.3334/ORNLDAAC/1203,"This data set provides modeled carbon flux estimates at 8-km spatial resolution over North America for the year 2004 of (1) net ecosystem exchange (NEE) of carbon dioxide (CO2), (2) net ecosystem production (NEP, the balance of net primary production and heterotrophic respiration), (3) stream evasion (CO2 emitted from streams and rivers), (4) emissions from harvested forest and agricultural products, and (5) emissions from biomass burning.Annual estimates, in g C/m2/year, are provided for all five fluxes. Daily estimates, in g C/m2/day, are provided for NEP and stream evasion fluxes. Fluxes for fire emissions, harvest decomposition/respiration, stream evasion, and NEP were derived as described in Section 5.NEE fluxes were estimated using a full bottom-up accounting of NEE produced by integrating emissions from harvested forest and agricultural products, CO2 emitted from streams and rivers, and biomass burning in the CarbonTracker (version 2011_oi) modeling system. NEE estimates were run in the forward mode through the CarbonTracker inversion setup that calculates CO2 uptake and release at the Earth's surface over time. Refer to Turner et al.(2013) for details.There are seven data files in NetCDF (.nc) format with this data set, including: five annual files for fire emissions, harvest decomposition/respiration, stream evasion, NEP, and NEE fluxes; and two daily files for NEP and stream evasion fluxes.",NACP_MODELED_NEE_NEP_FLUXES_1203,COMPLETE,3,Variables mapped on uniform space-time grid scales with completeness and consistency,,,2.74,90.0,-179.55,-34.11,"POLYGON ((-34.11 2.74, -34.11 90, -179.55 90, -179.55 2.74, -34.11 2.74))"
collection,C179003141-ORNL_DAAC,NACP North American Forest Dynamics Project: Forest Disturbance and Regrowth Data,ORNL_DAAC,33,2019-04-15T18:39:47Z,,NACP North American Forest Dynamics Project: Forest Disturbance and Regrowth Data,1,10.3334/ORNLDAAC/1077,"This data set provides the results of time-series analyses of Landsat imagery for 55 selected forested sites across the conterminous U.S.A. The output is a pair of disturbance data products for each site, one showing the first year of disturbance in the time series, the other showing the last year of disturbance. Each data pixel is labeled as either a static land class (persistent non-forest, persistent forest, or persistent water) or with the year of change for disturbed forest pixels. The time period analyzed is approximately 1984-2009.These forest disturbance data are distributed as a single band GeoTiff, with appropriate projection information defined within the file. The analyses were performed in three phases: 5 sites during the Prototype/Focal phase; 23 sites in Phase I; and 27 sites in Phase II. The spatial resolution of the Prototype/Focal and Phase I data is 28.5 meters. The spatial resolution of the Phase II data is 30 meters. The temporal resolution is nominally biennial. The mapped area for each forested site is approximately 185 km x 185 km. There are a total of 110 GeoTiff files - a first year and a last year disturbance file for each of the 55 sites.",NAFD_DISTURBANCE_1077,COMPLETE,3,Variables mapped on uniform space-time grid scales with completeness and consistency,,,26.52,49.79,-126.46,-67.96,"POLYGON ((-67.95999999999999 26.52, -67.95999999999999 49.79, -126.46 49.79, -126.46 26.52, -67.95999999999999 26.52))"
collection,C1422976806-ORNL_DAAC,"NACP Peatland Land Cover Map of Upper Peninsula, Michigan, 2007-2011",ORNL_DAAC,10,2019-04-15T18:54:12Z,,"NACP Peatland Land Cover Map of Upper Peninsula, Michigan, 2007-2011",1,10.3334/ORNLDAAC/1513,This dataset provides a land cover map focused on peatland ecosystems in the upper peninsula of Michigan. The map was produced at 12.5-m resolution using a multi-sensor fusion (optical and L-band SAR) approach with imagery from Landsat-5 TM and ALOS PALSAR collected between 2007 and 2011. A random forest classifier trained with polygons delineated from field data and aerial photography was used to determine pixel classes. Accuracy assessment based on field-sampled sites show high overall map accuracy (92%).,NACP_Peatland_Land_Cover_MI_1513,COMPLETE,4,model products,,,44.54,48.75,-91.08,-82.29,"POLYGON ((-82.29000000000001 44.54, -82.29000000000001 48.75, -91.08 48.75, -91.08 44.54, -82.29000000000001 44.54))"
collection,C1000000480-ORNL_DAAC,"NACP Peatland Landcover Type and Wildfire Burn Severity Maps, Alberta, Canada",ORNL_DAAC,20,2019-04-15T18:54:03Z,,"NACP Peatland Landcover Type and Wildfire Burn Severity Maps, Alberta, Canada",1,10.3334/ORNLDAAC/1283,"This data set provides landcover maps of (1) peatland type (bog, fen, marsh, swamp) with levels of biomass (open, forested) and (2) Burn Severity Index (BSI) (Dyrness and Norum, 1983) for four wildfire areas in northern Alberta, Canada. The four wildfire sites include the Utikuma fire site of 2011, Kidney Lake fire site of 2011, Fort McMurray west fire site of 2009, and Fort McMurray east fire site of 2009. The peatland classification at 12.5-m resolution (fen vs. bog including treed vs. open vs. shrubby) at each wildfire site was based on a pre-burn 2007 multi-date, multi-sensor fusion (Optical-IR, C-band and L-band SAR) approach. Over 350 field locations were sampled in central Alberta to train and validate the peatland type maps. The additional site, Wabasca, was an unburned site. Burn severity was measured in the field using the Burn Severity Index (BSI) (Dyrness and Norum 1987), a qualitative assessment of burnt moss that uses a 1-5 scale, with 1 being unburnt and 5 being severely burnt. The field data of ground consumption were correlated with Landsat pre- and post-burn imagery, specific to peatlands, to develop multivariate models for calculating burn severity and %-not-sphagnum-moss. These models were used to generate the Burn Severity Maps at 30-m resolution (percent unburned moss, and the burn severity index (BSI)). All sites were visited in 2013 for field measurements and the Utikuma site was also visited in 2012 for field measurements. Additional biophysical data for the various peatlands (aboveground biomass - tree and shrub, plant heights, density, etc. were collected and will be provided in another data set). There are five peatland type maps in GeoTIFF (*.tif) format and six burn severity maps in GeoTIFF (*.tif) format with this data set. Field data from centeral Alberta used to train and validate the peatland type maps is included as comma-separated (*.csv) file.",NACP_PEATLAND_BURN-SEVERITY_1283,COMPLETE,3,Variables mapped on uniform space-time grid scales with completeness and consistency,,,56.91,57.21,-114.9,-110.29,"POLYGON ((-110.29 56.91, -110.29 57.21, -114.9 57.21, -114.9 56.91, -110.29 56.91))"
collection,C179124085-ORNL_DAAC,NACP Regional: Gridded 1-deg Observation Data and Biosphere and Inverse Model Outputs,ORNL_DAAC,33,2019-04-15T18:39:51Z,,NACP Regional: Gridded 1-deg Observation Data and Biosphere and Inverse Model Outputs,1,10.3334/ORNLDAAC/1157,"This data set contains standardized gridded observation data, terrestrial biosphere model output data, and inverse model simulations of carbon flux parameters that were used in the North American Carbon Program (NACP) Regional Synthesis activities. The data set provides five observation data files (MODIS GPP, MODIS NPP, FIA forest biomass/forest area, NASS crop NPP, and NASS agricultural land fraction) and simulation results from 18 terrestrial biosphere models (TBM) (28 variables; 114 files) and seven inverse models (IM) (two variables; 8 files). To produce this data set, the NACP Modeling and Synthesis Thematic Data Center (MAST-DC) resampled original model simulation results and observation measurement data to 1-degree spatial resolution for North American region, interpolated into monthly or yearly temporal resolution, and reformatted into Climate and Forecast (CF) convention compatible netCDF format. ",NACP_REGIONAL_OBS_MODEL_GRID_1157,COMPLETE,4,model products,,,10.0,84.0,-170.0,-50.0,"POLYGON ((-50 10, -50 84, -170 84, -170 10, -50 10))"
collection,C179125385-ORNL_DAAC,NACP Regional: National Greenhouse Gas Inventories and Aggregated Gridded Model Data,ORNL_DAAC,33,2019-04-15T18:39:57Z,,NACP Regional: National Greenhouse Gas Inventories and Aggregated Gridded Model Data,1,10.3334/ORNLDAAC/1179,"This data set provides two products that were derived from the recently published North American Carbon Program (NACP) Regional Synthesis 1-degree terrestrial biosphere model (TBM) and inverse model (IM) outputs (Gridded 1-deg Observation Data and Biosphere and Inverse Model Outputs, Wei et al., 2013). The first product is the aggregation of the standardized gridded 1-degree TBM and IM outputs to the Greenhouse Gas (GHG) inventory zones as defined for North America (United States, Canada, and Mexico). Depending on the data availability, the monthly/yearly Net Ecosystem Exchange (NEE), Net Primary Production (NPP), Total Vegetation Carbon (VegC), Heterotrophic Respiration (Rh), and Fire Emissions (FE) outputs from the 22 TBM and 7 IM models were aggregated from the 1-degree resolution gridded format to the inventory zones and then, further divided into Forest Lands, Crop Lands, and Other Lands sectors within each inventory zone based on the 1-km resolution GLC2000 land cover map (GLC2000, 2003).The second product is the North American national GHG inventories on the scale of inventory zones which contain estimated land-atmosphere exchange of CO2 (NEE) in forest lands, crop lands, and other lands sectors. NEE estimates were synthesized from inventory-based data on productivity, ecosystem carbon stock change, and harvested product stock change, and additional information from national-level GHG inventories of the United States, Canada, and Mexico including EPA (2011) and Environment Canada (2011).An additional summary file of annual mean NEE (2000-2006)is provided for both land sectors and reporting zones in North America and was created by combining the aggregated model output and the national GHG database and is provided. The aggregated monthly and yearly model output data and the national GHG inventories data are available in comma separated value (*.csv) format files. Also provided are detailed inventory zone spatial data as an ESRI Shapefile. Included are zone names, boundaries, and zone and land cover type area attributes. For mapping convenience, the inventory zones shapefile was merged with 1-km forest, crop, and other lands masks to create a 1-km resolution reference data file that was converted to GeoTIFF format. The GeoTIFF defines to which inventory zone and land cover type each 1-km grid cell belongs.This document provides detailed information about the content, format, and processing procedures of these two data products. Detailed descriptions of the TBMs and IMs can be found in a separate companion document: NACP Regional Synthesis - Description of Observations and Models. ",NACP_REGIONAL_MODEL_GHG_AGGR_1179,COMPLETE,4,model products,,,10.0,84.0,-170.0,-50.0,"POLYGON ((-50 10, -50 84, -170 84, -170 10, -50 10))"
