cmr_concept_type,cmr_concept_id,cmr_native_id,cmr_provider_id,cmr_revision_id,cmr_revision_date,cmr_publication_date,coll_title,coll_version,coll_doi,coll_abstract,coll_shortname,coll_status,coll_proclvl,coll_proclvl_desc,time_min,time_max,lat_min,lat_max,lon_min,lon_max,geometry
collection,C179126565-ORNL_DAAC,"Forest Structure and Biomass Data, La Selva, Costa Rica: 2006",ORNL_DAAC,35,2019-04-15T17:59:36Z,,"Forest Structure and Biomass Data, La Selva, Costa Rica: 2006",1,10.3334/ORNLDAAC/1215,"This data set provides field measurements of diameter, tree height, and crown dimensions for 1,513 trees in 30 plots at the La Selva Biological Station in Costa Rica. Fourteen of these plots were in undisturbed primary forest, six were in primary forest which had been selectively logged, seven were secondary forests, and three were abandoned pastures reverting to forest. The diameter and height data were used to calculate aboveground biomass for each of the 30 plots. The crown measurements were used to estimate a vertical profile for each plot, showing the vegetation volume in 1 meter increments from the ground to the top of the canopy.There are three comma-delimited data files and two shapefiles with this data set. The files contain the measurements and calculated biomass for the individual stems as well as the summary data at the plot level.",LASELVA_BIOMASS_1215,COMPLETE,3,Variables mapped on uniform space-time grid scales with completeness and consistency,,,-90.0,90.0,-180.0,180.0,"POLYGON ((180 -90, 180 90, -180 90, -180 -90, 180 -90))"
collection,C1375939970-ORNL_DAAC,"Landsat-based Phenology and Tree Ring Characterization, Eastern US Forests, 1984-2013",ORNL_DAAC,14,2019-04-15T18:55:21Z,,"Landsat-based Phenology and Tree Ring Characterization, Eastern US Forests, 1984-2013",1,10.3334/ORNLDAAC/1369,"This data set provides a 30-year record of Landsat TM and ETM+ derived forest phenology and the results of tree ring analyses for annual wood production and nitrogen and carbon isotopic composition at 113 selected forested sites in the eastern United States. The sites are located in four national parks: Prince William Forest Park (PRWI), Harpers Ferry National Historical Park (HAFE), Catoctin Mountain Park (CATO), and Great Smoky Mountains National Park (GRSM). Phenology and tree ring data cover 1984-2013.",Dendrophenology_Eastern_US_1369,COMPLETE,3,Variables mapped on uniform space-time grid scales with completeness and consistency,,,35.34,39.69,-84.03,-77.32,"POLYGON ((-77.31999999999999 35.34, -77.31999999999999 39.69, -84.03 39.69, -84.03 35.34, -77.31999999999999 35.34))"
collection,C1000000081-ORNL_DAAC,Location and Permanency of Water Bodies in the African Sahel Region from 2003-2011,ORNL_DAAC,23,2019-04-15T18:53:53Z,,Location and Permanency of Water Bodies in the African Sahel Region from 2003-2011,1,10.3334/ORNLDAAC/1269,"This data set provides an estimate of the spatial and temporal extent of surface water at 250-m resolution over nine years (2003-2011) for the African Sahel region (10-20 degrees N) using imagery from the Moderate-resolution Imaging Spectroradiometer (MODIS). Water bodies were identified by a spectral analysis of MODIS vegetation indices with the aim to improve existing regional to global mapping products. This data set can be used to enhance the understanding of Earth system processes, and to support global change studies, agricultural planning, and disease prevention. These data provide a gridded (250-m) estimate of the number of years (during 2003-2011) that a pixel was covered by water. The data are presented in a single netCDF (*.nc) file.",SAHEL_WATER_BODIES_1269,COMPLETE,3,Variables mapped on uniform space-time grid scales with completeness and consistency,,,10.0,20.0,-20.0,40.0,"POLYGON ((40 10, 40 20, -20 20, -20 10, 40 10))"
collection,C1536980020-ORNL_DAAC,Mean Annual Fluxes of Carbon in Coastal Ecosystems of Eastern North America,ORNL_DAAC,8,2019-10-15T22:07:18Z,,Mean Annual Fluxes of Carbon in Coastal Ecosystems of Eastern North America,1,10.3334/ORNLDAAC/1594,"This dataset contains best estimates and uncertainties for mean annual fluxes of inorganic, organic, and total (organic + inorganic) carbon in tidal wetlands, estuaries and shelf waters of eastern North America, which is defined by the coastline running between the tip of the Scotian Peninsula (Canada) and the southern tip of Florida (USA). The data are provided on a per-unit-area basis and as spatially integrated values for each of the three ecosystem types (tidal wetlands, estuaries, and shelf waters) and the entire coastal ecosystem (tidal wetlands + estuaries + shelf waters) as well as for three geographic subregions (the Gulf of Maine, the Mid-Atlantic Bight, and the South Atlantic Bight) and the entire Eastern North America domain (Gulf of Maine + Mid-Atlantic Bight + South Atlantic Bight). The data include the net uptake from the atmosphere by the three ecosystems; burial in tidal wetland soils, estuarine sediments, and continental shelf sediments; riverine input from land to estuaries; and the net lateral advective transports from ecosystem to ecosystem. In addition, heterotrophic respiration (HR), net primary production (NPP), and net ecosystem production (NEP) estimates were computed for each ecosystem. The fluxes were derived using a variety of sources and are estimates for average conditions over the past decades from data covering roughly the period 1976-01-01 to 2017-12-31.",Coastal_Carbon_Budget_NE_US_1594,COMPLETE,4,model products,,,25.0,45.0,-85.0,-65.0,"POLYGON ((-65 25, -65 45, -85 45, -85 25, -65 25))"
collection,C1492226063-ORNL_DAAC,MODIS-derived Vegetation and Albedo Parameters for Agroecosystem-Climate Modeling,ORNL_DAAC,12,2019-04-15T18:54:34Z,,MODIS-derived Vegetation and Albedo Parameters for Agroecosystem-Climate Modeling,1,10.3334/ORNLDAAC/1539,"This dataset provides MODIS-derived leaf area index (LAI), stem area index (SAI), vegetation area fraction, dominant landcover category, and albedo parameters for the continental US (CONUS), parts of southern Canada, and Mexico at 30 km resolution. The data cover the period 2003-2010 and were developed to be used as surface input data for regional agroecosystem-climate models. MODIS Collection 5 products used to derive these parameters included the Terra yearly water mask, vegetation continuous field products, the combined Terra and Aqua yearly land-cover category (LCC) (MCD12Q1), 8-day composites for LAI (MCD15A2), and albedo parameter (MCD43B1) products. Please note that the MODIS Version 5 land data products used in this dataset have been superseded by Version 6 data products.",US_MODIS_Veg_Parameters_1539,COMPLETE,4,model products,,,15.15,49.15,-139.05,-51.95,"POLYGON ((-51.95 15.15, -51.95 49.15, -139.05 49.15, -139.05 15.15, -51.95 15.15))"
collection,C179124165-ORNL_DAAC,"NACP Aboveground Biomass and Carbon Baseline Data, V.2 (NBCD 2000), U.S.A., 2000",ORNL_DAAC,33,2019-04-15T18:39:53Z,,"NACP Aboveground Biomass and Carbon Baseline Data, V.2 (NBCD 2000), U.S.A., 2000",2,10.3334/ORNLDAAC/1161,"The NBCD 2000 (National Biomass and Carbon Dataset for the Year 2000) data set provides a high-resolution (30 m) map of year-2000 baseline estimates of basal area-weighted canopy height, aboveground live dry biomass, and standing carbon stock for the conterminous United States. This data set distributes, for each of 66 map zones, a set of six raster files in GeoTIFF format. There is a detailed README companion file for each map zone. There is also an ArcGIS shapefile (mapping_zone_shapefile.shp) with the boundaries of all the map zones. A mosaic image of biomass at 240 m resolution for the whole conterminous U.S. is also included.Please read this important note regarding the differences of Version 2 from Version 1 of the NBCD 2000 data. With Version 1, in some mapping zones, certain land cover types (in particular Shrubs, NLCD Type 52) were missing from and unaccounted for in modeled estimates because of a lack of reference data. In Version 1, when landcover types were missing in the models, the model for the deciduous tree cover type was applied. While more woody vegetation was mapped, the authors think this had little effect on model performance as in most cases NLCD version 1 cover type was not a strong predictor of modeled estimates (See companion Mapping Zone Readme files). In Version 2, after renewed modeling efforts and user feedback, these previously unaccounted for cover types are now included in modeled estimates.All 66 mapping zones were updated with the previously unmapped land cover types now mapped. The authors recommend use of the new version for all analyses and will only support the updated version.Development of the data set used an empirical modeling approach that combined USDA Forest Service Forest Inventory and Analysis (FIA) data with high-resolution InSAR data acquired from the 2000 Shuttle Radar Topography Mission (SRTM) and optical remote sensing data acquired from the Landsat ETM+ sensor. Three-season Landsat ETM+ data were systematically compiled by the Multi-Resolution Land Characteristics Consortium (MRLC) between 1999 and 2002 for the entire U.S. and were the foundation for development of both the USGS National Land Cover Dataset 2001 (NLCD 2001) and the Landscape Fire and Resource Management Planning Tools Project (LANDFIRE). Products from both the NLCD 2001 (landcover and canopy density) and LANDFIRE (existing vegetation type) projects as well as topographic information from the USGS National Elevation Dataset (NED) were used within the NBCD 2000 project as spatial predictor layers for canopy height and biomass estimation. Forest survey data provided by the USDA Forest Service FIA program were made available to the project under a national Memorandum of Understanding. The response variables (canopy height and biomass) used in model development and validation were derived from the FIA database (FIADB). Production of the NLCD 2001 and LANDFIRE projects was based on a mapping zone approach in which the conterminous U.S. was split into 66 ecoregionally distinct mapping zones. This mapping zone approach was also adopted by the NBCD 2000 project. ",NBCD2000_V2_1161,COMPLETE,3,Variables mapped on uniform space-time grid scales with completeness and consistency,,,26.52,49.79,-126.46,-67.96,"POLYGON ((-67.95999999999999 26.52, -67.95999999999999 49.79, -126.46 49.79, -126.46 26.52, -67.95999999999999 26.52))"
collection,C1243024158-ORNL_DAAC,"NACP Biome-BGC Modeled Ecosystem Carbon Balance, Pacific Northwest, USA, 1986-2010",ORNL_DAAC,23,2019-04-15T18:54:31Z,,"NACP Biome-BGC Modeled Ecosystem Carbon Balance, Pacific Northwest, USA, 1986-2010",1,10.3334/ORNLDAAC/1317,"This data set provides Biome-BGC modeled estimates of carbon stocks and fluxes in the U.S. Pacific Northwest for the years 1986-2010. Fluxes include net ecosystem production (NEP), and net aboveground wood growth. Stocks include aboveground wood mass. Also present are mapped distributions of associated forest disturbances, distinguished by disturbance type (harvest, fire, pest/pathogen). The data are presented in a mapped form as well as in tabular summaries broken out by ownership and ecoregion. Maps of annual precipitation and temperature data are included for the years 1980-2010.",NACP_PNW_Carbon_Balance_1317,COMPLETE,4,model products,,,42.0,50.0,-125.0,-109.0,"POLYGON ((-109 42, -109 50, -125 50, -125 42, -109 42))"
collection,C179002945-ORNL_DAAC,NACP Forest Age Maps at 1-km Resolution for Canada (2004) and the U.S.A. (2006),ORNL_DAAC,33,2019-04-15T18:39:48Z,,NACP Forest Age Maps at 1-km Resolution for Canada (2004) and the U.S.A. (2006),1,10.3334/ORNLDAAC/1096,"This data set provides forest age map products at 1-km resolution for Canada and the United States (U.S.A.). These continental forest age maps were compiled from forest inventory data, historical fire data, optical satellite data, and the images from the NASA Landsat Ecosystem Disturbance Adaptive Processing System (LEDAPS) project. These input data products have various sources and creation dates as described in the source paper by Pan et al. (2011). Canadian maps were produced with data available through 2004 and U.S.A. maps with data available through 2006. A supplementary map of the standard deviations for age estimates was developed for quantifying uncertainty.Note that the Pan et al. (2011) paper is included as a companion file with this data set and was the source of descriptions in the guide.Forest age, implicitly reflecting the past disturbance legacy, is a simple and direct surrogate for the time since disturbance and may be used in various forest carbon analyses that concern the impact of disturbances. By combining geographic information about forest age with estimated carbon dynamics by forest type, it is possible to conduct a simple but powerful analysis of the net CO2 uptake by forests, and the potential for increasing (or decreasing) this rate as a result of direct human intervention in the disturbance/age status.",NA_TREEAGE_1096,COMPLETE,3,Variables mapped on uniform space-time grid scales with completeness and consistency,,,7.71,67.01,179.25,-39.87,"POLYGON ((-39.87 7.71, -39.87 67.01000000000001, 179.25 67.01000000000001, 179.25 7.71, -39.87 7.71))"
collection,C179126465-ORNL_DAAC,"NACP Greenhouse Gases Multi-Source Data Compilation, 2000-2009",ORNL_DAAC,32,2019-04-15T18:40:06Z,,"NACP Greenhouse Gases Multi-Source Data Compilation, 2000-2009",1,10.3334/ORNLDAAC/1206,"This data set is a collection of measurements of carbon dioxide (CO2) and non-CO2 greenhouse gases made across North America by nine independent atmospheric monitoring networks from 2000 - 2009. During this North American Carbon Program (NACP) sponsored activity, data were compiled from the following networks: AGAGE, COBRA, CSIRO, INTEX-A, INTEX B, Irvine Latitude Network, NOAA CMDL, SCRIPPS, and Stanley Tyler-UC Irvine. The files presented here are the products of merging multiple original measurement results files for selected sites across North America from each monitoring network. The primary focus of this effort was the compilation of non-CO2 greenhouse gases over North America, but numerous CO2 observations are also included. The data files for each network are accompanied by detailed readme documentation files prepared by the respective network investigators. Project descriptions, objectives, references, sampling and analysis methods, and data file descriptions are included in these READMEs. Table 1 in the documentation displays the monitoring network sites, sample types, analytes, and links to the detailed network README files. Network- and laboratory-specific data citations are included in the README documentation and should be used to acknowledge the use of these data as appropriate. The data files for each monitoring network and each sampling type (continuous or flasks) have been combined into one compressed (*.zip) file along with the detailed README document. There are 17 compressed files that when expanded contain data files which represent one years data for that specific campaign and sampling method. The number of annual files that were compiled from a network into this collection varies.",NACP_GHG_DATA_COMPILATION_1206,COMPLETE,3,Variables mapped on uniform space-time grid scales with completeness and consistency,,,13.17,82.47,-165.4,-59.42,"POLYGON ((-59.42 13.17, -59.42 82.47, -165.4 82.47, -165.4 13.17, -59.42 13.17))"
collection,C179124645-ORNL_DAAC,"NACP Integrated Wildland and Cropland 30-m Fuel Characteristics Map, U.S.A., 2010",ORNL_DAAC,33,2019-04-15T18:39:55Z,,"NACP Integrated Wildland and Cropland 30-m Fuel Characteristics Map, U.S.A., 2010",1,10.3334/ORNLDAAC/1163,"The data set provides a 30-m comprehensive fuelbed characteristics map for both the wildland and cropland areas of the conterminous United States (CONUS) for 2010. This integrated product is the result of combining the spatially discrete Fuel Characteristic Classification System (FCCS) data of the US Forest Service (USFS) with the crop-and grassland-specific information of the US Department of Agricultures (USDA's) Cropland Data Layer (CDL).  By combining the spatially discrete details of the FCCS data set with the crop-and grassland-specific information of the CDL, a more robust map of fuelbed characteristics is available. The merged product has an advantage over the original FCCS map for estimating emissions from burned areas due to the integration of the fuelbed characteristics for agricultural areas from the CDL.There are three GeoTIFF format files and three comma-separated companion files distributed with this data set. The three tif files provided are very large and exceed the size limits of a standard GeoTIFF file format (4 GB). File sizes range from 20 to 30 GB. Compressed file sizes range from 2 to 3 GB. They are in a format that is called a BigTIFF file. ArcGIS 10.0 and ERDAS Imagine are able to read these files.",NACP_WILD_CROPLAND_FUEL_MAP_1163,COMPLETE,3,Variables mapped on uniform space-time grid scales with completeness and consistency,,,26.52,49.79,-126.46,-67.96,"POLYGON ((-67.95999999999999 26.52, -67.95999999999999 49.79, -126.46 49.79, -126.46 26.52, -67.95999999999999 26.52))"
collection,C1000000180-ORNL_DAAC,"NACP LiDAR-based Biomass Estimates, Boreal Forest Biome, North America, 2005-2006",ORNL_DAAC,19,2019-04-15T18:53:56Z,,"NACP LiDAR-based Biomass Estimates, Boreal Forest Biome, North America, 2005-2006",1,10.3334/ORNLDAAC/1273,"This data set provides estimates of aboveground biomass (AGB) for defined land cover types within World Wildlife Fund (WWF) ecoregions across the boreal biome of Alaska and western and eastern Canada, roughly between 45 and 70 degrees N. The study focused on within-growing-season data, i.e. leaf-on conditions.The AGB estimates were derived from a series of models that first related ground-based measured biomass to Portable Airborne Laser System (PALS) LiDAR measurements, and a second set of models that related the airborne estimates of biomass to Geoscience Laser Altimeter System (GLAS) LiDAR canopy structure measurements. The GLAS LiDAR biomass estimates were extrapolated by land cover types and ecoregions across the entire biome area.The study compiled remotely sensed forest structure data collected in June of 2005 and 2006 from the GLAS LiDAR instrument aboard the NASA Ice, Cloud, and land Elevation (ICESat) satellite and from the PALS airborne instrument flown at various times from 2005-2009 over both the ground plots and the ICESat GLAS flight path. For a consistent biome-level analysis, ecoregions contained within the boreal forest biome were identified by the World Wildlife Fund's (WWF) ecoregion map of the world (Olson et al., 2001). Land cover maps were used to identify land cover types for stratification purposes within eco-regions. Land cover data for Canada were provided by the Earth Observations for Sustainable Development (EOSD) project centered on year 2000, with images from 1999 to 2002. The National Land Cover Data (NLCD) 2001 classification was used for Alaska based on data collected between 1999 and 2004. The ground-based measurements are not provided with this data set.",NACP_BOREAL_BIOME_BIOMASS_1273,COMPLETE,3,Variables mapped on uniform space-time grid scales with completeness and consistency,,,44.51,69.0,-165.0,-53.0,"POLYGON ((-53 44.51, -53 69, -165 69, -165 44.51, -53 44.51))"
collection,C179126445-ORNL_DAAC,"NACP MCI: CO2 Emissions Inventory, Upper Midwest Region, USA., 2007",ORNL_DAAC,32,2019-04-15T18:40:05Z,,"NACP MCI: CO2 Emissions Inventory, Upper Midwest Region, USA., 2007",1,10.3334/ORNLDAAC/1205,"This data set provides a bottom-up CO2 emissions inventory for the mid-continent region of the United States for the year 2007. The study was undertaken as part of the North American Carbon Program (NACP) Mid-Continent Intensive (MCI) campaign. Emissions for the MCI region were compiled from these resources into nine inventory sources (Table 1):(1) forest biomass and soil carbon, harvested woody products carbon, and agricultural soil carbon from the U.S. Greenhouse Gas (GHG) Inventory (EPA, 2010; Heath et al., 2011);(2) high resolution data on fossil and biofuel CO2 emissions from Vulcan (Gurney et al,. 2009); (3) CO2 uptake by agricultural crops, lateral transport in crop biomass harvest, and livestock CO2 emissions using USDA statistics (West et al., 2011); (4) agricultural residue burning (McCarty et al., 2011);(5) CO2 emissions from landfills (EPA, 2012);(6) and CO2 losses from human respiration using U.S. Census data (West et al., 2009). The CO2 inventory in the MCI region was dominated by fossil fuel combustion, carbon uptake during crop production, carbon export in biomass (commodities) from the region, and to a lesser extent, carbon sinks in forest growth and incorporation of carbon into timber products. ",NACP_MCI_CO2_INVENTORY_1205,COMPLETE,3,Variables mapped on uniform space-time grid scales with completeness and consistency,,,36.0,50.0,-105.0,-81.0,"POLYGON ((-81 36, -81 50, -105 50, -105 36, -81 36))"
collection,C179126425-ORNL_DAAC,"NACP MCI: CO2 Flux from Inversion Modeling, Upper Midwest Region, USA, 2007",ORNL_DAAC,32,2019-04-15T18:40:03Z,,"NACP MCI: CO2 Flux from Inversion Modeling, Upper Midwest Region, USA, 2007",1,10.3334/ORNLDAAC/1204,"This data set provides estimates of Net Ecosystem Exchange (NEE) flux for the U.S. Upper Midwest at 0.5-degree resolution for the year 2007. Estimates were produced by two atmospheric CO2 inversion systems (top-down), referenced as the continental Colorado State University (CSU) inversion and the mesoscale Pennsylvania State University (PSU) inversion. This modeling work was performed in support of the North American Carbon Program (NACP) Mid-Continent Intensive (MCI) experimental campaign in the U.S. Upper Midwest designed to evaluate innovative methods for CO2 flux inversion and data assimilation. The experiment was performed over a relatively flat, heavily managed agricultural landscape which features a high density of atmospheric CO2 observation measurements. Among the CO2 observations used by the inversion systems were results from a network of instrumented tall towers in the region. The NEE estimates were produced for comparison with CO2 fluxes derived from bottom-up inventory estimates.There are five data files with this data set. The NEE estimates are provided in two NetCDF files, one for each inversion system. Boundary CO2 inflow data used by each inversion system are provided in three comma-separated-format files (.csv).",NACP_MCI_CO2_INVERSIONS_1204,COMPLETE,4,model products,,,36.0,50.0,-105.0,-81.0,"POLYGON ((-81 36, -81 50, -105 50, -105 36, -81 36))"
collection,C179126645-ORNL_DAAC,"NACP MCI: Cropland Productivity and Biophysical Properties, Nebraska, USA, 2001-2008",ORNL_DAAC,32,2019-04-15T18:40:08Z,,"NACP MCI: Cropland Productivity and Biophysical Properties, Nebraska, USA, 2001-2008",1,10.3334/ORNLDAAC/1217,"This data set provides an integrated collection of (1) ground-based meteorological, radiometric, and vegetation measurements, (2) flux-based estimates of gross primary production (GPP), and (3) numerous vegetation indices derived from satellite imagery for three eddy covariance flux tower locations near Lincoln, Nebraska, USA. Land use surrounding the towers is cropland with corn and soybeans. Data are reported for selected days during the growing seasons of 2001 through 2008 only when ground-based crop canopy reflectance was measured. Algorithms developed to relate ground-based and satellite spectral information to GPP of the cropland adjacent to the towers are provided. AmeriFlux tower-based Level 2 measurements included photosynthetically active radiation (PAR), heat flux, and GPP estimates; see Section 2 for specific towers.Ground-based measurements on the corn and soybean vegetation surrounding the towers included total chlorophyll content (Chl) and leaf area index (LAI). Ground-based crop canopy reflectance was measured at 5.4 m above the corn and soybean canopy using hyperspectral radiometers (range 400 to 1100 nm) during the growing season from May to October in eight different years (2001-2008). This resulted in 173 measurement campaigns (18 in 2001, 31 in 2002, 34 in 2003, 31 in 2004, 21 in 2005, 15 in 2006, 14 in 2007, and 9 in 2008). Spectral bands from Landsat TM and ETM+, MERIS , and MODIS instruments were used to calculate vegetation indices. Vegetation indices related to chlorophyll can be used as a proxy for GPP because of the observed close relationship between GPP and Chl content in crops. Algorithms developed to relate spectral information to the GPP of the cropland adjacent to the towers are provided as companion files.",NACP_MCI_CROP_GPP_1217,COMPLETE,3,Variables mapped on uniform space-time grid scales with completeness and consistency,,,41.16,41.18,-96.48,-96.44,"POLYGON ((-96.44 41.16, -96.44 41.18, -96.48 41.18, -96.48 41.16, -96.44 41.16))"
